{
  "schema_version": 1,
  "work_order_id": "202b9b23f1e14448a10fc74c254ce3c6",
  "outcome": "proposal",
  "summary": "The model response size is limited to 65536 bytes, and the corresponding error identifier is 'model_response_too_large'.",
  "evidence": [
    {
      "path": "src/forge_controller/model.py",
      "start_line": 46,
      "end_line": 47,
      "claim": "The response size is limited to 65536 bytes, and exceeding this limit raises a 'ModelError' with the identifier 'model_response_too_large'."
    }
  ],
  "changes": [],
  "uncertainties": [],
  "checks_not_run": [
    "tests"
  ]
}
